LSR_GOODS_CD,LSR_GOODS_NM,GOODS_GUID_CN
38984,[대구 신암] 궁전 라벤더,"도심 속 휴식공간 유럽식 사우나, 종합레포츠타운 궁전라벤더 최상의 여유와 품격을 궁전라벤더에서 누려보세요!"
38989,[제주 남원] 코코몽에코파크,
38990,[제주 색달] 퍼시픽랜드 일몰 요트투어 샹그릴라,
38993,[경기 부천] 웅진플레이도시 워터파크&스파 레드 패밀리 주말 연간이용권,가족과 물놀이를 계획 중이라면 웅진플레이도시 워터파크가 답이다 !  스파시설부터 다양한 물놀이 시설이 준비 되어 있어서 남녀노소 누구나 다 즐길 수 있습니다. 빅 재미로 가득한 웅진 플레이도시에서 온 가족과 함께 즐겨요~
38999,[서울 강서] 코코몽 키즈랜드 강서점,"아이들에게 친근한 캐릭터 놀이터 <코코몽 키즈랜드>  주기적인 살균관리와 벽면 공기정화기 등 깨끗한 환경을 유지하고 있어 엄마들에게 인기가 높은 곳입니다. 아이들이 접하는 모든 모서리는 둥글고 부드럽게 처리되어 마음껏 뛰어다녀도 다칠 염려 없어요. 미니 레이싱 경기장, 코코몽 어드벤처 볼풀장, 오물조물 편백놀이터, 댄스댄스~ 트램폴린 놀이터 등 체력과 감성을 쑥쑥 자라게 하는 키즈놀이터 코코몽에서 즐겁게 놀아보세요."
39001,[광주 북구] 코코몽 키즈랜드 광주역점,"아이들에게 친근한 캐릭터 놀이터 <코코몽 키즈랜드>  주기적인 살균관리와 벽면 공기정화기 등 깨끗한 환경을 유지하고 있어 엄마들에게 인기가 높은 곳입니다. 아이들이 접하는 모든 모서리는 둥글고 부드럽게 처리되어 마음껏 뛰어다녀도 다칠 염려 없어요. 미니 레이싱 경기장, 코코몽 어드벤처 볼풀장, 오물조물 편백놀이터, 댄스댄스~ 트램폴린 놀이터 등 체력과 감성을 쑥쑥 자라게 하는 키즈놀이터 코코몽에서 즐겁게 놀아보세요."
39003,[대전 중구] 코코몽 키즈랜드 대전 중앙로점,"아이들에게 친근한 캐릭터 놀이터 <코코몽 키즈랜드>  주기적인 살균관리와 벽면 공기정화기 등 깨끗한 환경을 유지하고 있어 엄마들에게 인기가 높은 곳입니다. 아이들이 접하는 모든 모서리는 둥글고 부드럽게 처리되어 마음껏 뛰어다녀도 다칠 염려 없어요. 미니 레이싱 경기장, 코코몽 어드벤처 볼풀장, 오물조물 편백놀이터, 댄스댄스~ 트램폴린 놀이터 등 체력과 감성을 쑥쑥 자라게 하는 키즈놀이터 코코몽에서 즐겁게 놀아보세요."
39005,[대구 동구] 얼라이브 아쿠아리움 2인권,"새로움을 창조하는 얼라이브 아쿠아리움 대구는 매일매일 색다른 즐거움을 느낄 수 있고, 체험과 동물들과의 교감을 통해 특별한 경험과 잊지 못할 감동을 선사합니다. 대표 생물인 '매너티' 와의 교감이 돋보이는 피딩&토크쇼가 준비되어 있으며, 트리하우스에서는 앵무새와 수달 등 초근접 카메라를 활용하여 독특한 외형과 특징을 대형 화면으로 관찰할 수 있습니다. 물 위에서 수조를 내려다 볼 수 있는 '대구 바다 구름다리', 돔형태의 파노라마 수조인 '천장 수조' 화려한 조명과 거울이 만나 펼쳐지는 ‘바다 미로 수조’ 등 최신 아쿠아 전시기법의 이색 수조를 통해 다양한 시선에서 관람할 수 있습니다. 이밖에도 바다의 환상적인 느낌을 전하는 ‘블랙아트’와 다양한 포토 포인트의 ‘트릭아트 작품’ , 그리고 내가 그린 바다 생물이 살아 움직이는 ‘스케치 아쿠아리움’등 아쿠아리움 곳곳에 색다른 재미가 가득합니다. 판타스틱하고 환상적인 체험들을 선사하는 펀(Fun)한 얼라이브 아쿠아리움을 만나보세요."
39007,[충남 아산] 아산스파비스 종일권 ★ 3일특가,온 가족 건강증진을 위한 종합 온천테마파크입니다. 수도권에서 1시간대에 접근가능 아산 스파비스! 온천 테마파크에서 쌓인 피로를 날려버려요~
39012,[강원 영월] 동강시스타 힐링스파 주말/공휴일 이용권,"순수한 자연 그대로의 스파~  순수한 자연의 치유력을 만날 수 있는 스파시설은 웰빙 테라피, 건강형 테라피 등을 통해 자연과 함께하는 건강한 휴식을 약속 합니다."
39016,[제주 한경] 유리의성,국내 최초 유리전문 등록 박물관 유리전문 테마파크 유리로 표현할 수 있는 모든 것을 상상하는 그 이상을 보게 될 것이다!
39021,[제주 대정] 송악카트,도내에서 바다를 보며 레이싱을 즐길 수 있는 유일한곳!
39023,[경기 수원] 코코몽 키즈랜드 동수원점,"아이들에게 친근한 캐릭터 놀이터 <코코몽 키즈랜드>  주기적인 살균관리와 벽면 공기정화기 등 깨끗한 환경을 유지하고 있어 엄마들에게 인기가 높은 곳입니다. 아이들이 접하는 모든 모서리는 둥글고 부드럽게 처리되어 마음껏 뛰어다녀도 다칠 염려 없어요. 미니 레이싱 경기장, 코코몽 어드벤처 볼풀장, 오물조물 편백놀이터, 댄스댄스~ 트램폴린 놀이터 등 체력과 감성을 쑥쑥 자라게 하는 키즈놀이터 코코몽에서 즐겁게 놀아보세요."
39024,[대구 수성] 코코몽 키즈랜드 동아수성점,"아이들에게 친근한 캐릭터 놀이터 <코코몽 키즈랜드>  주기적인 살균관리와 벽면 공기정화기 등 깨끗한 환경을 유지하고 있어 엄마들에게 인기가 높은 곳입니다. 아이들이 접하는 모든 모서리는 둥글고 부드럽게 처리되어 마음껏 뛰어다녀도 다칠 염려 없어요. 미니 레이싱 경기장, 코코몽 어드벤처 볼풀장, 오물조물 편백놀이터, 댄스댄스~ 트램폴린 놀이터 등 체력과 감성을 쑥쑥 자라게 하는 키즈놀이터 코코몽에서 즐겁게 놀아보세요."
39025,[부산 금정] 코코몽 키즈랜드 부산대점,"아이들에게 친근한 캐릭터 놀이터 <코코몽 키즈랜드>  주기적인 살균관리와 벽면 공기정화기 등 깨끗한 환경을 유지하고 있어 엄마들에게 인기가 높은 곳입니다. 아이들이 접하는 모든 모서리는 둥글고 부드럽게 처리되어 마음껏 뛰어다녀도 다칠 염려 없어요. 미니 레이싱 경기장, 코코몽 어드벤처 볼풀장, 오물조물 편백놀이터, 댄스댄스~ 트램폴린 놀이터 등 체력과 감성을 쑥쑥 자라게 하는 키즈놀이터 코코몽에서 즐겁게 놀아보세요."
39027,[충남 천안] 상록리조트 놀이동산 BIG6 주말권,"17여 가지 놀이기구와 함께하는 즐거운 시간 <천안 상록리조트 놀이동산 이용권> 바이킹, 범퍼카, 회전목마, 우주 전투기, 하늘자전거 등 웬만한 놀이기구는 다 모였다! 17종 놀이기구와 롯데리아, 푸드팰리스 등 음식점, 코인놀이기구 4종을 운영하고 있습니다. 천안 가족 나들이 장소로 더 없이 완벽한 상록리조트 놀이동산에서 온가족 즐거운 시간 가져보세요."
39032,[제주 성산] 성산포유람선 : 유람선투어,아름다운 제주의 해상투어 자연이 만들어 낸 아름다운 경관에서 바람을 느껴보세요!
39033,[부산 서구] 내원정사 템플스테이,도심 속 고즈넉한 정취가 있는 산사로의 발길은 '나'와  세상의 풍경을 되돌아보는 소중한 경험이 됩니다.
39034,[충남 공주]이안 숲속 주말권,"사계절 내내 푸르른 자연을 느끼고 볼 수 있는 '이안 숲속'입니다. 계절별로 색다른 모습을 선사하는 숲 속 풍경과 입장권 하나로 수영장, 동물원, 허브 정원 모두~ 누릴 수 있는 기회!  후회 1도 없는 이안 숲속으로 놀러오세요~"
39042,[부산 남구] 요트북,부산 해운대에서 요트위 낭만을 즐겨보세요 아름다운 부산야경과 함께 행복과 여유를 느낄수있어요
39052,[강원 평창 ] 평창 알펜시아 18/19 시즌 본2차 판매,스키&보드를 좋아하는 분들에게 희소식! 온라인에서 최초로 만나보는 평창 알펜시아 특가 시즌권입니다. 특가 시즌권을 구매하면 할인권 및 다양한 혜택까지 누릴 수 있어 보다 알찬 겨울여행을 준비할 수 있답니다. 올겨울 알펜시아 스키장에서 스키와 보드를 타며 하얀 설원을 누벼보세요!
39057,[부산 부산진구] 크리스마스 19금 후끈파티(★만 19세 이상 관람가능),"부산에서 열리는 후끈한 2018 크리스마스 파티!! 만 19세 이상만 즐길 수 있는 공연과 함께 친구, 연인과 연말 분위기를 느껴보세요.  행운권을 가지고 있다면 추첨 이벤트를 통해 경품도 받을수있으니 빨리 예매할수록 이득이겠죠~!"
39061,[경남 김해] 롯데워터파크 다회권,가을에도 즐기는 롯데 워터파크~ 아름다운 폴리네시아 해변에 펼쳐진 다양한 수상 놀이기구로 짜릿한 물놀이를 즐겨보세요! 365일 온 가족이 함께 즐길 수 있는 실내 워터파크와 스파시설도 있어 더욱 풍부하게 즐길 수 있답니다.
39070,[서울 종로] EVR 그라운드,"식상한 데이트는 이제 그만~  VR체험도 하고, 색다른 데이트도 즐겨보세요! 시간 가는줄도 모르고 즐겁게 할 수 있을거에요~  친구와 연인 손 꼭 잡고 VR 즐기러 함께 가요!"
39072,[대구 달서] 이월드 별빛축제 얼리버드,단10일만 진행하는 이월드 별빛축제!! 1000만송이 별빛 플라워 가든에서 펼쳐지는 별빛
39077,[전남 순천] 순천만국가정원 스카이큐브 탑승권,순천만으로 날아가는 하늘의 택시를 타보셨나요? 스카이큐브는 PRT시스템으로 첨단 제어로 자동 무인 운전이 가능할 뿐만 아니라 유럽 안전인증을 획득함으로써 안정성 또한 뛰어납니다. 스카이 큐브를 이용하시면 동천과 주변의 아름다운 경치를 만끽 할 수 있어 목적지까지 편안하고 즐거운 여행을 하실 수 있습니다.
39079,[전북 남원] jk항공 경비행기체험,하늘을 나는 기분을 현실로 느껴보세요! 전문조종사와 동승하여 안전하고 신나게 즐길수 있습니다 남원 광한루와 지리산 노고단의 아름다운 풍경을 한눈에 볼수있어요
39080,[경기 수원] 실내동물원 쥬몽 주말권,도심 속에서 만나는 실내동물원! 동물들을 그저 관광만 하는 동물원은 그만~ 창살을 걷어내고 교감할 수 있어 아이들이 더욱 좋아해요!
39085,[대전 서구] 뉴하이랜드 찜질방,넓고 쾌적하게 24시간 내내 언제든 자유롭게! 도심 속 힐링공간 신규 오픈 뉴하이랜드 사우나&찜질방
39086,[제주 성산] 블루마운틴 : 커피랜드,커피를 테마로 한 다양한 문화적 체험을 즐길수 있는공간 공정무역으로 매일 로스팅한 커피콩으로 다양한 커피를 접해보세요!
39088,[충남 천안] 상록아쿠아피아 겨울시즌 이용권,중부권을 대표하는 환상적인 실내물놀이 시설 상록 아쿠아피아 유수풀부터 파도풀 그리고 스파까지! 사계절 걱정없는 물놀이 천국!
39091,[서울 종로] 박물관은 살아있다+다이나믹 메이즈 : 인사동체험,
39092,[경기 용인] 에버랜드 대인+미취학 소인 (11/1~12/14),꿈과 환상의 나라로 떠나는 에버랜드 입장권! 매달 진행되는 축제도 즐기며 다양한 놀이기구까지 탈 수 있어요! 후회 1도 없는 에버랜드로 다함께 떠나요~
39095,[경기 과천] 서울랜드 종일권 커플권&패밀리권,눈이 즐겁고 오감이 짜릿한 경험을 하고 싶은가요? 멀리 가지 않아도 되요~ 서울랜드로 다 같이 떠나보아요!
39097,[경기 과천] 서울랜드 종일 자유이용권 ★ 임팩트딜,눈이 즐겁고 오감이 짜릿한 경험을 하고 싶은가요? 멀리 가지 않아도 되요~ 서울랜드로 다 같이 떠나보아요!
39100,[경기 용인] 캐리비안베이 이용+실내락커 (11/1~12/14),"설명이 필요없는곳, 캐리비안 베이를 누릴 수 있는 기회가 왔다! 카리브 해안을 테마로 한 시설과 다양한 어트랙션을 통해 워터파크 트렌드를 선도하고 있는 곳! 이국적인 카리브해의 정취 속에서 신나는 모험과 편안한 휴식을 모두 누려보세요."
39107,[서울 마포] VR스퀘어 홍대점 할로윈 특가,"식상한 데이트는 이제 그만~!  VR체험도 하고, 색다른 데이트도 즐겨보세요.  시간 가는줄도 모르고 즐겁게 할 수 있을거에요~  더 늦기전에 친구와 연인 손 꼭 잡고 VR 즐기러 함께 가요!"
39108,[전남 순천] 코코몽 키즈랜드 순천점 11월,"아이들에게 친근한 캐릭터 놀이터 <코코몽 키즈랜드> 주기적인 살균관리와 벽면 공기정화기 등 깨끗한 환경을 유지하고 있어 엄마들에게 인기가 높은 곳입니다. 아이들이 접하는 모든 모서리는 둥글고 부드럽게 처리되어 마음껏 뛰어다녀도 다칠 염려 없어요. 미니 레이싱 경기장, 코코몽 어드벤처 볼풀장, 오물조물 편백놀이터, 댄스댄스~ 트램폴린 놀이터 등 체력과 감성을 쑥쑥 자라게 하는 키즈놀이터 코코몽에서 즐겁게 놀아보세요."
39109,[서울 송파] 코코몽 키즈랜드 송파점 11월,"아이들에게 친근한 캐릭터 놀이터 <코코몽 키즈랜드> 주기적인 살균관리와 벽면 공기정화기 등 깨끗한 환경을 유지하고 있어 엄마들에게 인기가 높은 곳입니다. 아이들이 접하는 모든 모서리는 둥글고 부드럽게 처리되어 마음껏 뛰어다녀도 다칠 염려 없어요. 미니 레이싱 경기장, 코코몽 어드벤처 볼풀장, 오물조물 편백놀이터, 댄스댄스~ 트램폴린 놀이터 등 체력과 감성을 쑥쑥 자라게 하는 키즈놀이터 코코몽에서 즐겁게 놀아보세요."
39110,[경기 이천] 미란다 잼글 : 실내키즈체험,이천 최대의 시설과 깨끗한 환경으로 어린이들이 즐길 수 있는 잼글 쾌적한 공간에서 즐겨보세요!
39111,[경기 수원] 코코몽 키즈랜드 수원터미널점 11월,"아이들에게 친근한 캐릭터 놀이터 <코코몽 키즈랜드> 주기적인 살균관리와 벽면 공기정화기 등 깨끗한 환경을 유지하고 있어 엄마들에게 인기가 높은 곳입니다. 아이들이 접하는 모든 모서리는 둥글고 부드럽게 처리되어 마음껏 뛰어다녀도 다칠 염려 없어요. 미니 레이싱 경기장, 코코몽 어드벤처 볼풀장, 오물조물 편백놀이터, 댄스댄스~ 트램폴린 놀이터 등 체력과 감성을 쑥쑥 자라게 하는 키즈놀이터 코코몽에서 즐겁게 놀아보세요."
39113,[경기 이천] 지산D&D 스키강습★렌탈샵_지산리조트 : 스키장 개장 이벤트중!,렌탈부터 강습까지 겨울을 100% 즐길 수 있는 이천 D&D 렌탈샵으로 오세요!  신상 장비와 의류들을 보유하고 있어 멋지게 보드와 스키를 탈 수 있습니다. 또한 공인 강사진들로 구성된 강습으로 실력은 더 UP !  늦기전에 D&D 렌탈샵으로 오세요~
39114,[경기 부천] 코코몽 키즈랜드 부천 뉴코아점,"아이들에게 친근한 캐릭터 놀이터 <코코몽 키즈랜드>  주기적인 살균관리와 벽면 공기정화기 등 깨끗한 환경을 유지하고 있어 엄마들에게 인기가 높은 곳입니다. 아이들이 접하는 모든 모서리는 둥글고 부드럽게 처리되어 마음껏 뛰어다녀도 다칠 염려 없어요. 미니 레이싱 경기장, 코코몽 어드벤처 볼풀장, 오물조물 편백놀이터, 댄스댄스~ 트램폴린 놀이터 등 체력과 감성을 쑥쑥 자라게 하는 키즈놀이터 코코몽에서 즐겁게 놀아보세요."
39116,[경기 남양주] 남양주 뮤지엄 투어패스 (유기농 테마파크 외 4곳),"파리 뮤지엄패스를 잇는 남양주 뮤지엄투어패스!! 티켓 한장으로 5개 뮤지엄 입장은 물론, 테마체험까지 합쳐진 통합문화패스"
39117,[강원 평창] 알프스★렌탈샵_용평 스키장,"스키의 계절이 돌아왔어요!! 편리한 접근성은 물론, 18/19 시즌 고급 장비들이 입고되었답니다 친절한 상담도 가능하니 멀리가지말고 알프스 렌탈샵으로 오세요~"
39118,[경기 포천] 평강랜드,"아름다운 자연속에서 일상의 여유를 느껴보세요~ 다양한 식물과 멋진 풍경으로 드라마 촬영지로도 인기랍니다 인생샷 남길수있는 배경이 펼쳐져있으니 가족, 연인, 친구와 함께 놀러오세요!!"
39119,[강원 평창] 휘닉스평창 시즌권 4차,"휘닉스 평창 스키장을 마음껏 이용할 수 있는 시즌권을 준비했습니다!  리프트, 곤돌라 등등 다채로운 재미를 자랑하는 휘닉스 파크!  서둘러서 시즌권 구매를 해보세요~"
39121,[서울 삼성] 코엑스 아쿠아리움 11월,물의 나라 코엑스 아쿠아리움에서 만나는 진기명기한 16가지 테마 현실세계는 잠시 뒤로 하고 멋진 수중세계로 떠나봅시다!
39123,[서울 마포] 자전거로 떠나는 연남동 카페 골목 투어★프립,"자전거 타고 자유로운 감성을 담은 연남동으로 함께 떠나요~! 가을 낭만을 즐기는 또 하나의 새로운 소확행! 연남동 골목길, 자전거 그리고 cafe...자전거와 커피를 사랑한다면 누구나 환영합니다:-) 미.남 (미니벨로 타는 남자) 현모코치와 함께 하는 라이딩은#안전 #감성 #재미 #유쾌 어느 것 하나 소홀할 수 없는, 그런 라이딩입니다~! 그리고 남는 건 사진뿐! 아기자기한 연남동 스팟에서  인스타그램 감성 사진 촬영 프립의 포인트! 스마일 ^___________^  지친 일상 속에서 시원한 바람을 따뜻한 사람들과 공유하고 싶은 분들 떠오르는 핫플레이스 연남동을 자전거로 느껴보고 싶은 분들 함께 해요!  아름다운 한강을 지나, 홍제천을 따라, 연남동을 누비고.. 서울의 작은 숲 월드컵 공원에서 따뜻한 커피, 차, 밀크티를 마시면서 이야기 나누겠습니다.  ※ 11월 17일 토요일은 맛집(파스타) 투어로 진행합니다.  안전과 직결되는 헬멧 착용은 필수입니다. 헬멧 미착용시 함께 라이딩할 수 없습니다. · 소수인원으로 진행하고, 사전 준비가 필요한 부분이 있어 당일 노쇼하셔도 '참석'으로 간주하겠습니다. · 당일 상황에 따라 라이딩 상세 일정이 조금 변경될 수 있습니다.· 음주나 약을 복용하신 분은 이용할 수 없습니다. · 프립 집결시간보다 지각하실 경우, 프립에 참여하실 수 없습니다. 시간 엄수바랍니다. · 리더에 통제를 따르지 않는 분은 귀가 조치합니다. · 사고 시 책임은 본인에게 있으며 고의가 아닌 한 다른 참석자에게 책임을 물을 수 없습니다. · 참가하시는 분은 위의 사항을 모두 동의하는 것으로 간주합니다."
39124,[서울 강남] 달리고 마시는 사람들 : 달마시안 ★프립 클래스,선릉 둘레길을 신나게 달린 후 스파클링 와인 한잔 어때요? 혼자 뛰지 않고 같이 뛰니 끝까지 포기하지 않고 뛰게 될 거에요. ^-^ 함께 뛴 크루들과 시원한 샴페인 어때요?  무료 3 종의 와인을 함께 즐기며 가볍게 와인 강의도 들을 수 있는 유익한 시간! · 신체의 이상이 있는 분은 반드시 호스트에게 미리 알려주시기 바랍니다. · 지나친 음주로 인한 피해에 대해서는 책임지지 않습니다. 숙취해소제는 서비스로 드립니다. · 우천 시에도 희망자에 한해서 뛰고 와인 시음회는 정상적으로 진행합니다.
39125,[서울 동작] 카우치 서핑 누구나 할 수 있다.,"[무중력지대 대방동 X 과시적 클래스] 청년들이 강사가 되어 직접 강의를 진행하는 과시적 클래스 11월 ‘오직 나만을 위한 2시간’   [ 카우치 서핑, 누구나 할 수 있다! Surfer / Host로서의 경험 ]  * 11월 8일(목) 19:00~21:00 터키 국가 대표랑 하키 게임 뜨기?  중동에서 여성 인권 이야기하기?셰프 호스트 덕에 상다리 부서지게 불가리아 음식 먹은 썰, 요정 같은 러시아 소녀와의 하룻밤,\n호주 부자가 들려준 진짜 부자들의 이야기,  블록체인 강연자 게스트의 1:1 강연, 치즈 종류만 수백 개! 프랑스 게스트랑 미식 이야기, 복지국가에서 온 핀란드 남의 천국과 지옥 썰 엿듣기, K-POP 팬에게 한국어 가르쳐주기,  고어 물 + 레슬링 덕후와 밤새 WWE 레슬링 이야기하기,  100만원으로 2개월 전 세계 돌기...2013년부터 친구의 추천으로 우연히 카우치 서핑을 시작했습니다. 그리고 느낀 점!  ‘돈과 시간 없어도 누구나 할 수 있는 세계여행 = 카우치 서핑’ 한국에 방문하는 수많은 여행객의 호스트를 해왔고  9개국의 호스트를 만나서 그들의 아파트, 별장, 호텔 등 다양한 곳에서 묵었습니다.  보석 같은 순간부터 아찔했던 순간까지 가까이서 들려주고 싶어요.  1. 호스트를 시작하는 방법, 마음가짐 2. 게스트 잘 되는 팁. 3. 국내를 해외여행처럼! 쉽게 친구 사귀는 방법인 카우치 서핑 이용 팁을 알려드릴게요.  카우치 서핑이라는 문화가 아직 넓게 알려지지 않아 활용법을 잘 모르는 사람이 많아요.  처음 카우치 서핑을 접하는 사람에게는 흥미 유발, 이제 막 알게 되어  호스팅에 흥미가 있는 사람에게는 실제 실천으로 갈 수 있는 계기를 만드는 강연입니다. 낯선 이와 함께 가장 가까운 곳을 내어준다는 것이 부담스러울 수 있지만  직접 체험한 화자를 통해서 두려움을 없애고 ‘그저 재워주기, 자기’에 그치는 것이 아니라  더 활용할 수 있는 방법을 알려줄 수 있습니다. 또한 ‘청년’ 여행자들에게도 비용 없이  현지인을 만나며 여행할 방법을 알게 되어 더 깊이 로컬 문화를 체험, 이해하게끔 도와주려고 합니다.  호스팅을 할 수 없는 상황에도 ‘카우치 서핑’의 여러 기능으로 앱을 활용하는 법을 알려드려요.  서울특별시에서 운영하는 무중력지대 대방동은 청년들이 자유롭게 이용할 수 있는 청년 공간으로  청년들의 다양한 프로젝트를 지원하고, 청년들을 위한 강의를 제공하고 있습니다.  과시적 클래스는 청년이 각각 강사, 수강생이 되어 자신만의 콘텐츠를 공유하는  청년 교육 지원 사업입니다. 8월 ‘청년 X 미디어’, 9월 ‘청년 X 브랜딩’,  10월, 11월에는 ‘오직 나만을 위한 2시간’을 주제로 진행됩니다.  해당 프로그램은 서울특별시의 지원을 받아 운영되기 때문에 소정의 강의료만 받고  진행되니 이 점 참고해 주시길 바랍니다.  · 프로그램 참여대상 : 만 19세 - 39세 청년이라면 누구나! · 원활한 진행을 위해, 10분 전 미리 도착 바랍니다.  · 당일 현장에서 개인정보 활용동의서를 받을 예정이오니 이 점 참고 부탁드립니다. (서울특별시 지원 사업으로 운영되어 결과 보고를 위한 사진 및 영상 아카이빙을 위한 목적이며, 홍보 자료로도 이용될 예정입니다.)"
39126,[서울 광진] 스윙댄스 함께 춰요! 스윙이즈 ★프립 클래스,"You and I, We are the swing holics! 너와나, 우리 스윙에 빠지다! 우리 같이 춤출래요? 한 번도 춰본 적 없어도 괜찮아요. 당신이 첫 스텝을 밟는 순간, 새로운 세상이 펼쳐질 거예요. 춤이라는 걸 배우는 게 어려울 것 같고 모르는 사람과 함께 추는 것이 부담스러우신가요? '스윙댄스'는 남녀노소 누구나 부담 없이 즐길 수 있는 취미이고, 실내 취미라서 날씨를 많이 타지 않으며실내용 신발 외에는 준비할 장비도 없고  다른 취미에 비해 비용도 많이 들지 않는다는 장점이 있답니다."
39127,[서울 광진] 도자기 만들기 / 도예 원데이클래스 ★프립 클래스,"[디세 × 이재철도예공방]의COLLABORATION!-매력적이고 감성적인 공간의 대명사-이재철도예공방에서 이루어지는디세의 재미있는 원데이클래스! “화병이 좋아? 접시가 좋아?”약 2시간 동안 화병이나 (파스타)접시 중 하나를 골라 만드시게 됩니다. 미리 구글링(?)을 통해 형태를 찾아 오시거나, 디세가 제안 해드리는 형태 중에 고르셔서 내가 쓸 도자기를 직접 만들어 보세요!"
