LSR_GOODS_CD,LSR_GOODS_NM,GOODS_GUID_CN
19,[전북 전주]말순이 : 한옥마을 한복대여권,전주 한복대여 말순이   한옥마을의 중심 한복대여 1번가 한복대여점 말순이는 한옥 마을 중심에 위치해 접근성 뛰어 납니다. 다양한 한복이 마련 되어 있어 컨셉에 맞게 골라 입어볼 수 있습니다. 사물함이 구비 되어 있어 짐걱정 없이 가볍게 촬영을 즐길 수 있습니다. 전주에서 예쁜 한복입고 예쁜 추억 만드세요.
25,[서울 홍대] 러브뮤지엄 : 이색전시회,2호선 홍대입구역 9출구에서 도보 약 5분 거리에 위치한 러브뮤지엄  일반 전시회들과는 조금 다른 색다른 전시회로 권태기도 풀리게 한다는 그 전시관! 민망할 수도 있지만   재미있게 즐기다 올 수 있는 곳입니다. 유머러스하고  남다른 사진들로 한번뿐인 추억을 남기고 오세요.
31,[전북 전주] 플라이코리아 패러글라이딩,뛰어난 풍광으로 패러글라이더들에게 인기  시간당 1팀만 예약이 가능하니 더 여유롭게 체험해 볼 수 있어요. 대중교통을 이용하신다면 미리 픽업을 예약해주세요. 쉽게 배우는 안전교육! 장비착용 후 - 도약준비완료 - 힘찬 뜀박질 후 - 전주 하늘을 활공 전주 하늘에서 추억만들기 성공!  잊지 못 할 전주의 하늘을 지금 바로 체험해 보세요.
108,[경기 여주] 쎈토이 뮤지엄 입장권(키덜트),섬세하게 재현된 피규어의 천국  다양한 장르의 캐릭터가 구현되어 있어요. 대형크기로 제작된 캐릭터 피규어들이 있어 사진촬영으로 추억을 남길 수 있답니다. 피규어 전시만 구경하는 것이 아닌  기프트존이 구성되어 구매가 가능하니 눈으로 보기만 아쉽다면 기프트 존으로 가면 됩니다. 다양하게 구경하고 사진찍고 피규들과 함께 행복한 시간을 보내보는건 어떨까요?
124,[서울 종로] 리브레 : 수제비누 & 향초 만들기 체험,"오늘 방 향기는 너야 너, 예쁜데 향도 좋은 너 종로 리브레: 수제비누& 향초 만들기  사랑하는 사람에게 직접 만든 특별한 향초와 비누를! 내 손으로 만들어서 더욱 의미 있는 선물입니다  비누와 향초에 들어가는 재료는 모두 천연! 아이들도 쓸 수 있는 안전한 제품입니다.  만들 시간이 없다면 직접 만든 제품들을 구매할 수도 있어요. 선물하실 생각이라면 선물 포장을 요청해주세요~  세련된 포장을 해드립니다.  단 하나밖에 없는 나만의 천연비누 만들기로 좋은 추억 만들어가세요."
140,[경기 시흥] 창조자연사 박물관 입장권,"엄마! 우리 여기가요! 아이들이 좋아하는 시흥 창조자연사 박물관  호기심 많은 아이를 위해 생태 학습장을 찾는다면 창조자연사를 방문해보세요. 움직이는 공룡들은 물론, 기증을 통해 얻은 진짜 화석들까지 모두 전시되어 있어요. 뿐만 아니라 화석을 직접 만들어 볼 수 있는 프로그램이 준비되어 있어, 절대 잊지 못할 추억이 만들어지는 곳입니다.  공룡랜드, 골격 공룡관, 블랙홀, 화석 광물관, 해양 생태관, 해양 패류관, 익룡관, 나비 곤충관 등  아이의 호기심을 자극하는 다양한 테마가 준비되어 있답니다.  실내와 실외가 모두 공룡들로 가득 차 더욱 실감 나는 생태 학습 체험이 가득한 창조 자연사 세상에서 아이와 함께 즐겨보시는 게 어떠세요?"
141,[충북 단양] 클레이사격,"이색적인 스포츠! 단양 클레이사격  클레이 사격이란? 진흙으로 빚은 주황색 접시 모양의 표적을 쏘아 맞히는 고급 레저 스포츠에요. 대중 스포츠가 아니라서 이색 레저 체험의 천국인 단양에서도 한 곳뿐이랍니다.  귀마개, 사격 조끼, 엽총, 실탄 등 클레이 사격에 필요한 모든 장비가 갖추어져 있으니 몸만 오시면 됩니다. 누구나 안전교육과 강습만 받으면 쉽게 즐길 수 있습니다.  흔히 접하기 힘든 스포츠로 매력적인 클레이 사격을 경험하러 단양으로 출발해보세요."
155,[서울 신도림] 뛰뛰빵빵 점핑랜드,
197,[서울 강남] 클라임이모션,
268,[충남 당진] 삽교호 카트월드 이용권,"숨어있던 질주본능이 깨어난다! 당진 카트월드 짜릿한 드리프트! 멈출 수 없는 스피드!  다양한 볼거리와 즐길 거리가 있는 당진 삽교호 카트월드는 서해대교를 비롯하여 호수와 바다를 감상하며 레이싱을 즐길 수 있는 짜릿한 레저 공간입니다 다양한 코너와 함께 낮이든 밤이든 시간에 구애받지 않고 즐길 수 있어요 넓은 카트장에서 마음껏 씽씽 달려보세요 2인용 카트도 준비되어있어 안전한 레이싱으로 아이들이 더 좋아한답니다 부모님, 친구, 연인과 함께 즐기는 짜릿한 스피드~  오늘만큼은 당진 카트월드에서 스피드레이서가 되어보세요!"
744,"[충북 단양] 천동동굴 : 석회동굴, 단양명소","4억 5천만 년 동안 자연이 빚어낸 비경, 천연 석회동굴 탐험! 단양 천동동굴  자연을 만끽하며 마냥 걷고 싶은 운치 있는 오솔길을 지나면 나오는 수억만 년의 시간이 빚은 경이로운 동굴.  종유석, 석순, 석주 등의 파노라마 이 외에도 동굴생성물들이 다양하게 형성!  철제 관광로를 따라서 초근접 거리에서 동굴을 감상할 수 있습니다.  조각품보다 더 조각 같은 종유석, 석회암의 2차적 침전작용에 의해 만들어진 스펠레오뎀,  유석의 흘러내린 모양이 닭발처럼 생겼다고 해서 거대 닭발, 천동 동굴의 하이라이트인 지하궁전에서 펼쳐지는 종유석과 석주, 석순까지   올여름은 이색적인 동굴체험으로 시원한 여름보내는게 어떠세요?"
796,[서울 강남] 크리센트 : 향수  만들기 원데이 클래스,"세상에서 단 하나뿐인 향, 크리센트 : 향수 만들기 원데이 클래스 의미 있는 선물, 하나뿐인 희귀템. 나만의 향수를 만들어보세요  향수 타입을 정하고 향료를 시향한다음, 원하시는 향료를 골라주세요 원하는 향료를 골랐다면 조향차트를 작성해주세요 전문가가 직접 향의 조화를 고려해 가감해준답니다.  샘플을 만들어 볼 수 있어서 만족도가 UP! 샘플을 바탕으로 본 품을 제작한 뒤, 예쁘게 포장까지 할 수 있습니다.  후각은 감정과 기억을 담당하는 뇌와 연결이 된다고 하죠,  소중한 사람에게 특별한 기억을 선물해 볼까요?"
853,[서울 중구] 남대문 실탄사격장,"현대인의 지긋지긋한 스트레스를 날려줄 사이다 같은 한방! < 남대문 실탄 사격장 > 이 서울 한복판에 떴습니다. (4호선 회현역 도보 약 6분) - 선택장애도 OK 다양한 총 앞에서 당황하지 마세요. 전문가가 나에게 맞는 기종 선택을 도와드립니다. - 초보자도 OK 낯설어도 걱정 말아요. 숙련된 조교가 기본자세부터 꼼꼼하게 가르쳐드립니다. - 무사고 OK 방탄복, 고글, 귀마개 등 장비 착용 + 1:1 안전교육 후 진행되니, 목숨 걸고 체험하세요. - 인증샷은 필수 촬영용 거치대 & 카메라가 설치되어 사격하는 내 모습을 영상으로 현장감 있게 담아낼 수 있습니다. - 기념품 증정 표적지는 기념이자 추억으로 가져가셔도 좋습니다. - 차 한잔의 여유 박진감 넘쳤던 게임이 끝나면 서로의 실력을 헐뜯으며 충분한 대화와 휴식을 가져보세요. 남대문 실탄사격장으로 스트레스 쏘러 가자고~"
972,[강원 강릉] 아라나비토종 짚라인 왕복권,"600M 바다 위 하늘길을 나는 익스트림 체험! 아라나비 토종 집라인  아름다운 바다 위를 나비처럼 훨훨 날고 싶다면  올여름 아라나비 집라인을 체험해 보세요.  안전교육을 받고 장비를 착용한 뒤, 힘차게 날아올라 바다를 향해 쭉 미끄러져 내려가는 집라인. 두근거리는 심장을 부여잡고 돌아보면 그제서야 보이는 주변 풍경들.  바다 위를 날 수 있다니 생각만 해도 설레실 거예요. 고대하던 여름휴가를 진부하게 보내지 말고 강릉 아라나비 짚라인으로 이색체험해 보시는 건 어떠세요?"
1021,[전북 전주] 한복길 한복대여,"한복 입고 걷는 아름다운 길 한복도 트렌드다!  매년, 새로운 콘셉의 의상을 선보여 2030에게 인기존인 한복길!  단아하고 수수한 스타일의 전통한복과 색감과 무늬가 화려한 테마 한복까지 다양하게 준비되어 있어 선택의 폭이 넓은데요. 그래서인지, 실제로 많은 사람이 직접 경험해보고 만족스러웠던 후기들도 많답니다 경기전, 전동성당 앞에 위치하여 한복 입고 관광하기에도 딱이에요.  일상복보단 한복이 잘 어울리는 한옥마을! 이왕이면 남들과 다른 의상으로 거리를 아름답게 빛내보세요."
1036,[서울 노원] 이창현 노원클라이밍센터,"재미 UP! 칼로리 DOWN! 떠오르는 다이어트!  요즘 스타들의 몸매 관리법으로 각광 받는 클라이밍을 아시나요? 평소 잠자고 있던 잔 근육을 사용해 칼로리 소모가 높아 다이어트에 효과적인 운동이랍니다  쉬운 코스부터 난코스까지 겸비해 누구나 즐길 수 있다는 게 매력이에요  강습은 세계선수권 4위(2013년)에 빛나는 국가대표가 직접 해주니 더 믿을 수 있겠죠?  중력을 거스르는 자, 탄탄한 몸매를 가질지니!  역세권에 위치해 접근성도 좋은 이창현 노원 클라이밍을 경험해보세요~~"
1090,[서울 상암] 코알라 클라이밍,"초보자 코스부터 굴곡 심한 전문코스까지! 도전하세요 실내 암벽등반 체험 코알라 클라이밍  전신 근력 운동에 탁월한 클라이밍! 누구나 쉽게 즐길 수 있는 실내 스포츠입니다 처음이라도 괜찮아요. 친절한 강사님이 자세부터, 이동방법, 움직임까지 세심하게 강습해주신답니다 초보자들을 위한 난이도 하 코스부터 실력자들을 위한 난이도 상 고급코스까지 준비되어있어요  이벤트나 다양한 정보를 얻을 수 있는 인포메이션, 샤워실, 탈의실, 클라이밍 장비를 구매할 수 있는 상점까지! 코알라 클라이밍 안에 다양한 부대시설들도 이용해보세요~"
1091,[서울 종로] 경복궁 한복대여 한복남,"※ 코로나로 인해 휴관될 수 있으니 매장에 문의 전화부탁드립니다.    16년 오픈한 한복 대여점, 종로 한복남 경복궁 한복대여  깨끗한 디자인의 한복을 차려입고 이색 고궁 나들이! 우리가 미처 몰랐던 서울의 아름다움을 발견하세요!  한복 입혀주는 남자 '한복남'은 여러분에게  가장 한국적인 아름다운 옷을 입혀드리며 평생 간직하고 싶은 사진을 찍어드리며 미처 몰랐던 한국의 재미있는 모습을 보여드립니다  왜 한복남이어야 할까요?  -4월에 신규 오픈하여 한복이 모두 깨끗하니까!   손때 타지 않은 A급 새 한복 남녀 300여 벌 준비  -서울 역사문화 관광지 중심에 위치하니까!   경복궁, 북촌한옥마을, 인사동 모두 5분 거리에 인접  -고객 편의를 생각한 150평 규모의 매장이니까!   물품보관소, 탈의실, 헤어메이크업실, 스튜디오, 휴게실 등 완비  100여 가지 디자인 한복을 갖춘 한복남에서 쇼핑하듯 골라 입어보세요."
1116,[경기 일산] 원마운트 아이봇,"산들산들 바람을 즐기며 호수공원 한 바퀴   호수공원에서 원마운트 아이봇과 함께 해보세요. 전동휠, 전동킥보드, 투휠보드, 나인봇미니  중 원하는 것을 택하고, 짜릿한 주행을 즐길 수 있습니다.  누구나 쉽게 즐길 수 있는 야외 레저 원마운트 아이봇! 아이봇의 매력 속으로 빠져봅시다."
1117,"[서울 여의도] 여의나루 아이봇, 전동킥보드","한강 나들이 새롭게 시작해 봅시다.  신개념 에코 레포츠  전동휠, 전동 킥보드, 전동 스케이트보드, 투휠보드, 외발휠 5가지 자유이용 원하는 아이봇을 택하여 짜릿한 질주를 해보세요. 누구나 쉽게 타고 즐길 수 있습니다. 아이봇의 매려으로 다같이 빠져 볼 까요?"
6669,[전남 여수] 카트 체험장,"실사판 카트라이더 즐겨보세요.  도로지면과 밀착하여 주행하기 때문에 더욱 생생한 속도감을 느낄 수 있습니다. 체감속도 70km/h로 달리는 카트의 속도감, 급커브 구간을 즐겨보세요. 10명이상의 단체 이용이 가능합니다.  시원하게 바람을 가르며 달리는 카트 지금 바로 실력을 뽐내 보세요."
11096,[서울 홍대] 반지카페 : 반지만들기 체험,
11439,[전남 여수] 국가대표 패러글라이딩,"공인 자격증을 갖춘 전문 강사진과 함께 안전하게 즐기는 패러글라이딩 체험  산과 바다가 어우러진 수려한 자연결경을 하늘 높은 곳에서 한눈에 담아볼 수 있습니다. 취향에 따라 다양한 코스들을 체험자가 직접 핸들링 할 수도 있어요. 사진, 동영상, 이벤트 등 다양한 서비스도 제공하고 있습니다."
11455,[서울 종로] MES 방탈출카페,"제한시간 60분, 흩어진 단서를 모으고 추리하여 방을 탈출해야 합니다.  7가지 테마를 갖춘 MES 방 탈출 카페. 오프라인 방 탈출 카페 끝판왕 메스에서 여러분을 기다리고 있습니다. 다양한 테마룸에서 이색적인 경험을 해보세요."
11516,[충북 단양]패러마을 패러글라이딩,
11528,[서울 동대문] 한복 웨딩카페,"한복은 물론 웨딩 드레스도 입어보세요.  한복을 입고 떠나는 시간여행,  아름다운 곳에서 예쁜 한복을 입고,  궁궐 속 공주, 황진이 테마를 선택하여,  이색적인 사진도 찍고,  색다른 추억까지 남기세요."
11542,[강원 강릉] 환희 컵 : 이색박물관,"영국 여왕이 썼던 커피 잔 보러 오세요  전 세계 희귀 컵 전시! 세계 다양한 컵 전시장, 앤티크 잔으로 커피 마시고, 컵 만들기 체험까지 색다른 경험을 할 수 있습니다. 산책로, 3D 증강현실 등 다양한 부대시설이 있습니다."
11651,[강원 평창] 조나단 패러글라이딩,"두려움은 찰나, 벅차오르는 감동은 평생  매일 똑같은 일상을 벗어나 빠르게 발을 구르다 떼면 펼쳐지는 맑고 푸른 풍경. 지쳐있던 일상에 특별한 선물을 줄 수 있습니다. 평창에서 든든한 강사님과 안전하게 하늘의 아름다움을 맛보세요. 체험을 다 끝낸 후 체험 인증서도 수여받으실 수 있습니다."
12700,[서울 상왕십리] 그 아저씨 도예공방 : 핸드페인팅 & 핸드빌딩,"애정 가득 나만의 도자기 만들기  전문 공예방으로 철저한 재료들과 초보자도 쉽게 도자기 공예를 즐길 수 있는 도자기 전문 강사진이 함께 수업을 진행합니다. 그릇 위 그림을 그리는 핸드페인팅, 그릇을 직접 만드는 핸드 빌딩 체험이 가능합니다. 자신만의 개성 있는 도자기를 만들어 보세요."
12834,[강촌/가평] 레저클럽 ATV/카트/스쿠터/수상레저 패키지,
12962,[서울 여의도] 한강 전동 퀵보드/다타코리아 대여,"은근히 짜릿한 속도감! 한강 라이딩족이 늘어나는 이유! 여의도 한강 전동 킥보드/ 아이봇 대여  1. 물건보관 소지품을 보관할 수 있는 보관함 완비 2. 보호장구 착용 안전을 위한 헬멧, 무릎&팔목보호대 착용 3. 데스크 접수 보호장비 착용 후 데스크에서 대여접수 4. 상품선택 타고 싶은 전동휠/전동 킥보드 고르기 5. 교육 후 라이딩 이용설명을 들은 뒤 즐기면 끝!  바람을 가르는 스피드가 그야말로 굿! 즐거운 여의도 한강 전동킥보드~ 어서 체험하러 오세요!"
12975,[전북 부안] 원숭이학교 & 자연사박물관,"익살스러운 원숭이 공연과 희귀 화석 보러 오세요! 부안 원숭이 학교 & 자연사 박물관  원숭이학교 문화관광부 지정 전라북도 제4호  전문박물관으로 등록된 특화 테마파크  자연사박물관 희귀하고 진귀한 화석 및 광물 등을  통해 자연사와 인류의 진화과정을 쉽게  이해할 수 있는 전시공간  원숭이 공연 개성만점 원숭이 학생들의  학교생활을 그려낸 공연 프로그램  오직 부안 원숭이 학교에만 있는 다양한 프로그램과 공연들, 자연사박물관까지! 지금 오셔서 신나는 체험 하고 가세요~~"
13003,[전북 전주] 프리미엄 동물카페 우쮸쮸,"동물도감이 따로 필요 없어요! 체험형 실내동물원 프리미엄 동물카페 우쮸쮸  동물도감에서만 보아왔던 희귀동물들을 직접 보고 만져볼 수 있는 체험형 동물카페에요 입장권을 구매해주시는 모든 분께 음료를 서비스로 제공해드려요  파충류, 포유류, 양서류, 조류, 곤충 등 다양한 동물 친구들이 있어요 동물 친구들을 쓰다듬어보고 직접 만져볼 수 있는 체험 활동도 있어요!  호기심 많은 우리 아이들에게 동화책 속에서 그림으로만 만나봤던 다양한 동물친구들을 직접 소개해주세요~"
13395,[서울 홍대] 심신프리카페 : 마사지,"공기 좋은 카페에서 토닥토닥 안마받고 가세요 신개념 힐링 심신프리카페  바쁜 일상을 벗어나 즐기는 휴식! 전신 마사지 기기에서 피로를 확 풀어봐요  청정공기를 재현해 쾌적한 산소테라피& 피로 회복의 끝판왕 허브 온열 찜질까지 준비되어있어요  심신프리카페 이용 시 음료 및 세계과자는 서비스~ 카페에서 만나보세요!  최고급 안마기기와 아늑한 공간의 조화 2인석에서 친구, 연인과 함께 즐길 수 있어요 전신 순환에 탁월한 최고급 전신 마사지 기기에서 힐링 타임 가지세요~"
13400,[경기 화성] 애니랜드 : 조류 & 체험동물원,"자연 친화적 체험학습! 화성 애니랜드!  화성 애니랜드는  조류/야외 동물원이 결합된 공간 먹는 새둥지 만들기 등 체험 거리 다수 직접 만지고 먹이주는 교감형 교육  동물원을 산책하면서 동물들과 서로 교감할 수 있는 체험을 합니다 조류와 초식동물들에게 직접 먹이를 주면서 아이들의 정서 발달에 도움을 줍니다 아이들이 직접 타면서 조랑말과 교감할 수 있습니다 먹는 새둥지를 직접 만들어 보면서 자연 생태계를 생각하게 됩니다  관람을 넘어 직접 만지며 교감할 수 있는 곳으로 아이들에게 인기 만점인 조류동물원, 아이들이 좋아하는 조랑말을 직접 타볼 수 있는 조랑말 타기 체험 등 여러 가지 체험프로그램이 준비되어있는 화성 애니랜드로 오세요~"
13507,[경기 김포] 김포 곤충농장,"손으로 직접 접해보는 생태체험 테마파크 살아있는 자연 교육장 김포 곤충농장  소풍을 즐기듯 희귀곤충, 동물과 교감하기!  수도권 인근 가족 나들이 코스로 딱! 김포 곤충농장 서울 도심에서 쉽게 찾아올 수 있어 주말 나들이로 최고랍니다  인솔교사의 자세한 설명을 들으며 눈으로 보고 손으로 접해보는 능동적인 체험 프로그램 생태체험관, 미꾸라지 관찰 등 다양한 생태에서 살아가는 희귀곤충과 동물 만나기  동물과 눈을 맞춰 가까이서 관찰하고 먹이를 주는 경험,  곤충들의 환경과 일생에 대해 학습할 수 있는 유익한 공간  김포 곤충농장에서 아이들에게 즐거운 주말을 선물해보세요~!"
13936,[충남 대천] 짚트랙,
13957,[인천 남동] 그레이트피그미풀 키즈파크,아이는 원 없이 놀아야죠! 시간 제한 없이 즐기세요~   인천 그레이트피그미풀 키즈파크는?  깨끗한 놀이공간 놀이 체험 존만 가득 찬 곳이 아니에요 마음껏 뛰어 놀 수 있는 공간도 준비하였답니다  무제한 이용시간 아이들은 원 없이 놀아야 된다는 사장님의 철학! 시간 제한 없이 마음껏 놀 수 있어요  온 가족 힐링공간 여유로운 공간은 물론 안마의자까지! 온 가족을 위한 복합 테마공간을 만나보세요  아이들 뿐 아니라 엄마들 사이에서도 인기만점!  인천 그레이트 피그미풀로 오세요~!
18909,[서울 강남] 피규어뮤지엄 W,"1천여 점 피규어 전시관 피규어 뮤지엄w 나만의 원목 액션 피규어 만들어 체험하기 각종 다양한 크기와 종류의 피규어들과 함께 사진도 찍고 관람할 수 있습니다. 또한 취향저격 피규어를 구매할 수있는 피규어 샵도 있습니다. 그이외에 체험, 놀이, 포토존등의 시설을 이용 할 수도 있습니다."
19407,[경기 양평] 추억의 청춘뮤지엄,
19541,[경북 경산] 경산 스파월드 : 사우나 & 찜질방,"2014년 경산시 우수 목욕업소 선정 사우나 & 찜질방 경산 스파월드  경산 스파월드는 경산 온천지역 맥반석 지대의 중심에 위치하고 있어 최상의 수질을 자랑하고 있습니다 대형 온천급 사우나, 고품격의 테마 찜질방, 수영장, 썰매장, 펜션등 다양한 부대시설을 겸비하고 있습니다  일상의 탈출과 더불어 가족 모두가 만족하는 즐거운 휴식 공간으로 충분할 것입니다  입장부터 편안하게 하실 수 있도록 대형 주차장, 다양한 부대시설 등 쾌적한 환경을 조성하였습니다  정말 '물' 좋은 경산 스파월드로 일상에 지친 피로 풀고 가세요~"
19589,[서울 목동] 목동 종합사격장,"다른 체험장에서 보기 힘든 공기총 사격도 가능! 취향저격 이색체험 목동 종합사격장  도심 속에서 스릴을 느끼고 싶다면 일상에 지친 그대를 위해 취향저격 이색체험  목동 종합사격장은 도심의 실내 사격장으로  실탄 사격과 공기총 사격시설을 모두 갖추었습니다 사격을 친근하게 느낄 수 있도록 가족 단위의 방문객에게  사격체험의 기회를 제공하며 선수 발굴 및 육성에도 힘을 기울이고 있습니다 또한, 실탄 권총사격 위주인 대부분의 시설과 달리 국제규격의 공기총사대 25개와  다수의 공기권총, 공기소총을 보유하고 있습니다"
19595,[서울 송파] 송파 사격장,"스트레스 날려버려 빵야- 빵야- 올림픽 영웅 진종오선수도 다녀간 사격체험장 올림픽 규격 사격장 송파 사격장  실제 올림픽 국제 규격 10M 사선, 21개 사대로 이루어진 공간에서 즐기는 이색 체험 공간, 송파사격장!  사격에 방해되는 물건은 모두 락커룸에 보관하고 표적에만 집중하실 수 있어요  전문가도 OK! 초보자도 OK! 안전 교육은 물론 1:1 맞춤 코칭까지 해드려요  사격장이 보이는 통유리 대기실이 마련되어 있어 커플뿐만 아니라 직장 동료 모임에도 제격이랍니다"
19598,[대전 동구] 그레이트피그미풀 : 대전복합터미널점,"이 정도는 돼야 키즈카페지 엄마들이 대전 그레이트피그미풀을 찾는 이유!  대전 그레이트 피그미풀은 이번 신규 오픈으로 깔끔한 공간이 돋보이는 곳입니다 일반 키즈카페와는 확실히 차이가 있습니다 -처음 보는 신개념 놀이공간은 물론, 같은 놀이도 새롭게 재해석하여 아이들 두뇌발달에 도움을 주도록 구성 -원하는 만큼, 마음껏 놀아도 초과금액 없이 모든 놀이 공간을 이용 가능 -복합놀이 공간에는 아이들의 놀이 공간과 더불어 함께 오신 부모님도 편안히 쉴 수 있는 안마의자 준비   벽뿐만 아니라 바닥에도 설치가 되어있는 스크린 플레이존은 센서가 있어서 아이들이 직접 손으로 조작이 가능하답니다. 아토피나 알러지가 있는 아이들의 건강한 놀이문화를 위해 편백나무 놀이터도 마련되어 있습니다.  그밖에도 어드벤처, 점핑플레이, 기차놀이, 플레이존, 키즈시네마, 쿠킹클래스 등의 다양한 프로그램이 마련되어 있습니다. 기타 부대시설로는 카페, 수유실, 물품보관함, 매점 등이 있으며 주변에 아이들이 체험하기 좋은 몇몇 관광지들이 가까운 곳에 마련되어 있으니 주변 관광지도 함께 체험해보시고 즐거운 시간이 되시길 바랍니다."
19722,[전북] 전북투어패스,"티켓 하나로 관광지 60여 곳 무료입장, 약 1000여 개  맛집, 체험, 숙박할인까지 가능한 만능패스권. 여행시간을 좀더 넉넉하고 여행비용은 절약하게 되는  전북 어디든 한방에 OK 전북에서 너무나도 편리하고  실용성 있는 전북투어패스권 놓치지 마세요."
